product_details,product_name,specifications
" Product Details  As low as $0.69 per oz over spot 10 oz Silver bars are an ideal way to add to your Silver holdings, and secondary market Silver bars can often be purchased at a lower premium than brand new bars. Each Silver bar is tested for Silver content and purity.  Bar Highlights:   Contains 10 oz of .999 fine Silver. Bars are randomly selected from a variety of brands and shapes based upon inventory available. Packaging may vary but all will be in protective packaging. Diverse mix of Silver bars from numerous manufacturers such as Sunshine Minting, U.S. Assay, APMEX and many others. Designs vary, which can add some collectibility. Protect your Silver while in storage from the adverse effects of moisture in the air by adding these silica gel desiccants to your order. With a variety of designs and manufacturers and a lower price point, these 10 oz secondary market Silver bars are a great way to add Silver to your investment portfolio. Add these 10 oz Silver bars to your cart today! We often ship various items within each shipment that may include themes such as holidays and other artistic designs. At times, Silver bars may tone due to the natural oxidation process that has no adverse effect on the value of the Silver. The bars we sell as secondary market bars may have nicks or scratches and are priced accordingly.   Related Searches  What are Secondary Market Metals?     Buy 10 oz Silver bars produced with a Precious Metal in demand for industrial uses. Many investors include 10 oz Silver bars in their investment portfolios because of the demand for Silver worldwide for industrial uses. While buying Silver bars and coins represents a small percentage of the Silver market, over 50% of the annual demand for physical Silver comes from its industrial applications in the fields of photography, medicine, solar energy and more. While the Silver spot price can be affected by the global demand for this Precious Metal, Silver prices tend to move independent of the stock market. If you like investing in secondary Silver bullion, consider adding secondary market Silver rounds to your portfolio, as well.    Storing 10 oz Silver bars safely is simple with Citadel Global Depository Services. Once you buy 10 oz Silver bars, you may wonder what is the best way to store and protect your investment. When you buy Silver bars from APMEX, you have the option of having your Silver bars shipped directly from the APMEX vault to Citadel Global Depository Services, Inc. , a wholly-owned subsidiary of APMEX. Providing maximum security storage for your Silver bullion, Citadel, which is managed by security-leader Brink’s, also offers online tracking and management tools with a unique inventory Web page for your investment. Choose Citadel to store your 10 oz Silver bars and any other Silver investments, and you benefit from Citadel’s insurance against theft, damage and physical loss.    Secondary market Silver bars are an excellent way to purchase quantities of .999 fine Silver at an affordable premium over spot.      ",10 oz Silver Bar - Secondary Market,"Product ID: 21,  Year: N/A,  Grade: None,  Grade Service: None,  Denomination: 10 oz,  Mint Mark: N/A,  Metal Content: 10 troy oz,  Purity: .999,  Thickness: Varies mm,  Diameter: N/A mm,  Outer Pack: 50,  "
" Product Details Sunshine Minting has taken the beloved Silver Morgan Dollar design and created a product that combines this classic design with Sunshine's unique security feature, MintMark SI™, which helps authenticate the origin and .999 purity of your Silver round.  Round Highlights:   Contains 1 oz of .999 fine Silver. Multiples of 20 rounds are packaged in sealed tubes. Multiples of 500 are packaged in boxes. Single rounds come in protective packaging. The design of these rounds is based on the original coin issued by the U.S. Mint. These rounds carry no actual face value. Eligible for Precious Metals IRAs . Obverse: A rendition of George T. Morgan's acclaimed “Morgan Dollar” design. Reverse: Features an eagle with wings outstretched, along with the mintmark SI™ feature, weight and purity. Guaranteed by Sunshine Minting. Authenticate your new Sunshine Minting Silver rounds by adding the Sunshine Mint Decoder Lens to your purchase. These exquisite rounds combine .999 fine Silver appeal with a classic American design. Add 1 oz Sunshine Morgan Dollar Silver Rounds to your cart today! When viewed through Sunshine Minting's special decoder lens at the same angle shown in the image above (with card held flush to your Silver round), the central design shows the word ""Valid,"" but when you turn the decoder lens ninety degrees, a sunburst appears. These two different views further verify your 1 oz Silver round. You can rest assured knowing you are getting the highest quality products possible produced by Sunshine Minting with the MintMark SI™ feature.    Add Morgan Silver Dollar rounds to your retirement portfolio for increased stability.  Plan for retirement with Morgan Silver Dollar rounds that are eligible for use with Precious Metals IRAs . By choosing 1 oz Silver rounds and other IRA-approved Gold and Silver bullion for your Precious Metals IRA, many investors believe you can hedge against economic uncertainty and balance your portfolio. Before buying Silver rounds, contact an APMEX IRA Specialist at (800) 418-0235 or by email at IRA@apmex.com , and we will guide you through the process of adding Precious Metals to your IRA. Buying Silver and other Precious Metals for your Precious Metals IRA means the bullion must be placed with an IRA custodian.    Save on Morgan Silver Dollar rounds with APMEX Market Alerts.  When buying Morgan Silver Dollar rounds, getting the best Silver price is easy to do when you set up an APMEX Market Alert. The price of 1 oz Silver rounds changes throughout the day due to fluctuations in the Silver spot price, so create an alert to notify you when the Silver spot price dips. Buy Silver rounds at your target price, and save your favorite purchases by creating an APMEX wish list. To buy the Silver rounds again, sign into your wish list to see your favorites without having to search the APMEX website.      ",1 oz Silver Round - Morgan Dollar (MintMark SI),"Product ID: 90488,  Year: N/A,  Grade: None,  Grade Service: None,  Denomination: 1 oz,  Mint Mark: SI,  Metal Content: 1 troy oz,  Purity: .999,  Thickness: 2.8 mm,  Diameter: 39 mm,  Inner Pack: 20,  Outer Pack: 500,  "
" Product Details  As low as $4.49 per coin over spot 2019 marks the 38th annual release of the Mexican Silver Libertad.  Silver Libertads are Mexico's treasured coins and this 2019 edition continues the beloved series that began in 1982.  Coin Highlights:   Contains 1 oz of .999 fine Silver. Individual coins come in protective packaging. Multiples of 25 are packaged in plastic tubes. Multiples of 450 are packaged in original rolls inside sealed bank bags. Eligible for Precious Metals IRAs . Obverse: Features a sculptural relief design of the National Shield, encompassed by the legend ""Estados Unidos Mexicanos"" (United Mexican States), surrounded by different national coats of arms used throughout Mexico's history. Reverse: Depicts two key symbols of the Mexican people: the Winged Victory statue in the forefront and the Mexican volcanoes Popocatépetl and Iztaccíhuatl in the background. Guaranteed by Banco de México. Protect your Silver Libertad with this clear plastic capsule  or display it in style by adding an attractive presentation box or jewelry bezel to your order. This magnificent 1 oz Silver coin is a popular choice not only because of its attractive design, but also its mintage at Casa de Moneda de México, the oldest mint in North America. Add this 2019 1 oz Silver Mexican Libertad coin to your cart today! 1 oz Silver Libertads 1982 was the year the Libertad was first struck in .999 fine 1 ounce Silver, with a Brilliant Uncirculated finish. The coin had a change in design after the 1996 release, then and again after the 1999 release, when the design changed to the current design of the 1 oz Silver Libertad. The original design from 1982 to 1996 was modeled after the famous Centenario Gold coin. 1 oz Silver Libertads have mintages that vary each year, and some years have mintages that are much lower than other bullion coins, adding to the 1 oz Silver Libertad series collectibility.   ",2019 Mexico 1 oz Silver Libertad BU,"Product ID: 181896,  Year: 2019,  Grade: Brilliant Unc,  Grade Service: None,  Denomination: 1 Onza,  Mint Mark: Mo - Mexico City,  Metal Content: 1 troy oz,  Purity: .999,  Thickness: 3 mm,  Diameter: 40 mm,  Inner Pack: 25,  Outer Pack: 450,  "
" Product Details  As low as $0.89 per oz over spot You can now get the famed Morgan Silver Dollar design on a full ounce of .999 fine Silver. This is a replica of George T. Morgan's beloved design, minted on American coinage from 1878 to 1904 and again in 1921. Designs may vary by mint.  Round Highlights:   Contains 1 oz of .999 fine Silver. Round comes in protective packaging. Multiples of 20 are packaged in tubes. This round has multiple manufacturers so designs may vary slightly. The design of these rounds is based on the original coin issued by the U.S. Mint. These rounds carry no actual face value. Obverse: Lady Liberty wearing a Phrygian cap with the motto ""Liberty"" inscribed in the headband. Reverse: Eagle with wings outstretched, also including the weight and purity. Protect your round in style by adding an attractive presentation box recommended for this round. The iconic Morgan Dollar design is nationally recognized, thereby increasing the value of owning these rounds. Add this beautiful 1 oz Silver round to your cart today.  ",1 oz Silver Round - Morgan Dollar Design,"Product ID: 55644,  Year: N/A,  Grade: None,  Grade Service: None,  Denomination: 1 oz,  Mint Mark: Varies,  Metal Content: 1 troy oz,  Purity: .999,  Thickness: 3.2 mm,  Diameter: 39.3 mm,  Inner Pack: 20,  Outer Pack: 500,  "
" Product Details  Any quantity only $0.01 per oz over spot An excellent way to inexpensively buy Silver, each $1 in face value (20 coins) contains coins with a composition of 35% Silver, 56% copper and 9% manganese.  Product Highlights:   Each $1.00 face value of nickels contains approximately 1.125 oz of Silver. Will come sealed in a tightly wrapped paper roll. Amounts of $50.00 or higher will come sealed in a canvas bag. These 35% Silver composition nickels were made from 1942 through 1945 as an emergency measure to alleviate the wartime shortage of nickel. The mintmark “P” for the Philadelphia mint was used for the first time in American coinage history. Protect your Silver in storage from the adverse effects of moisture in the air by adding these silica gel packets to your order. These average circulated Silver war nickels are a great way to invest! Add several $1 Face-Value Silver War Nickel rolls to your cart today! Pre-1965 35% Silver coins, sometimes referred to as junk Silver or scrap Silver, are a great way to start your Silver investments. These Silver coins were pulled from circulation with the introduction of copper/nickel clad coins and the rising demand of Silver. The public saved them for their 35% Silver content as a rainy day fund they can fall back on.   Related Searches  What Nickels are Silver?    These 35% roll of Nickels are ideal for the avid coin collector.   ",35% Silver War Nickels $1 Face Value Avg Circ,"Product ID: 13023,  Year: Random,  Grade: Other,  Grade Service: None,  Denomination: 5 Cents,  Mint Mark: Varies,  Metal Content: 1.125 troy oz,  Purity: .350,  Thickness: 1.95 mm,  Diameter: 21.2 mm,  "
" Product Details  As low as $22.49 per coin Enhance your Silver investments with these affordable cartwheels of yesteryear!  Product Highlights:   Each coin contains .7734 oz of Pure Silver. Coins come in protective packaging. Multiples of 20 come in plastic tubes. Multiples of 100 come in 100-count bags. Multiples of 500 come in 500-count bags. Obverse: Left facing profile of Liberty. Anna Willess Williams, a teacher and philosophical writer, modeled for this design by George T. Morgan of Lady Liberty. Reverse: Features a bald eagle clutching an olive branch in one talon and a bundle of arrows in the other. Surrounding the eagle is ""United States of America,"" ""One Dollar,"" and ""In God We Trust."" Protect and display your Morgan Dollar Collection in style by adding an attractive album or holder to your order. These Silver coins are average circulated and will show signs of wear. Add these Very Good to Very Fine Morgan Silver Dollars to your cart today! The Morgan Dollar holds a special place in U.S. coinage as it was the first coin to feature Lady Liberty with an American look, rather than the traditional Greek style. Her cap is adorned with wheat and cotton as a tribute to America's agricultural history. The image of the eagle was also updated for the Morgan Dollar, showing a proportionally correct eagle with beautifully designed feathers. He carries an olive branch, showing America's desire for peace, and is perched atop a bundle of arrows, signifying America's readiness to defend her borders against attack. The Morgan Dollar flooded the markets from 1878-1904. Nearly two decades after production halted, the Morgan Dollar was seen again for one year only, in 1921, due to a renewed desire for this iconic, beautiful design.   Related Searches  What is 90% Silver?     Collect Morgan Silver Dollars that celebrate the art of George T. Morgan.  Though Morgan Silver Dollars were among the first coins George T. Morgan designed as assistant engraver at the Philadelphia U.S. Mint, he had already established himself as an artist and engraver in England where he received instruction at the Birmingham Art School and South Kensington Art School and worked for The British Royal Mint. When U.S. Mint director H.R. Linderman first met Morgan, he told him he wanted Lady Liberty’s portrait to make a return to American coinage. This meeting led to Morgan’s Silver Dollar design. Before designing these Silver coins for sale , Morgan enrolled in the Academy of Art in Philadelphia to immerse himself in American art and to inspire his reinterpretation of the traditional Greek-looking Lady Liberty into a wholly American-looking version.    Morgan Silver Dollars found today escaped melting two different times in history.  Morgan Silver Dollars were minted in abundance from 1878 until 1904, and again in 1921, resulting in approximately 657 million Silver Dollars. Though so many Morgan Dollars were minted, two major pieces of legislation affected how many are left in existence: The Pittman Act of 1918 and the Silver Act of 1942. The Pittman Act authorized the melting of up to 350 million Silver Dollars to loan to Great Britain, and in 1942 more than 53 million Silver Dollars were melted for wartime use. Buying Silver coins from the Morgan Dollar series can be challenging at times, especially when you are searching for specific years or Silver coins from specific mints.    The Morgan Silver Dollar was the first U.S. coin to depict Lady Liberty with an American look, rather than the traditional Greek style.      ",1878-1904 Morgan Silver Dollar VG-VF (Random Year),"Product ID: 161,  Year: Random,  Grade: Other,  Grade Service: None,  Denomination: $1.00,  Mint Mark: Varies,  Metal Content: 0.7734 troy oz,  Purity: .900,  Thickness: 3.1 mm,  Diameter: 38.1 mm,  "
" Product Details  As low as $0.89 per oz over spot The 1 oz Silver Buffalo Bar pays tribute to America’s native tribes and the majestic, once endangered buffalo. James Earle Fraser’s design for the 1913 Buffalo Nickel has inspired both images featured on this bar. Mintmark and designs may vary.  Bar Highlights:   Contains 1 oz of .999 fine Silver. Individual bars come in protective packaging. Multiples of 20 come in plastic sheets and boxes contain multiples of 500. The design of these bars is based on the original coin issued by the U.S. Mint. Obverse: Depicts a Native American with the motto ”LIBERTY” across the top with weight and purity listed below. Reverse: The frosted finish of ""Black Diamond,"" an American bison (buffalo) atop a mound of dirt. Fraser sketched this design in the New York Central Park Zoo. Guaranteed by Silvertowne. James Earle Fraser's Indian Head nickel design is regarded among the best designs of any U.S. coin. Add this sought after Silver Buffalo Bar to your cart today!   ",1 oz Silver Bar - Buffalo,"Product ID: 97883,  Year: Undated,  Grade: None,  Grade Service: None,  Denomination: 1 oz,  Mint Mark: N/A,  Metal Content: 1 troy oz,  Purity: .999,  Thickness: 3.1 mm,  Diameter: 50.30 x 30.30 mm,  Inner Pack: 20,  Outer Pack: 500,  "
" Product Details This beautiful .999 fine Silver bar mimics the form of a dollar bill, giving the bar an interesting and unique design.  Bar Highlights:   Contains 1 oz of .999 fine silver. Comes in protective packaging. Obverse: An American bison standing atop a mound, with the 1 oz weight and .999 fine Silver purity of the bar stamped on either side of the bison. Reverse: Design may vary. Protect your Silver bar while handling it by adding cotton gloves to your order. 1 oz Silver bars are one of the easiest and most popular ways to acquire Silver. Add this 1 oz Bison Silver bar to your cart today!  ",1 oz Silver Bar - 1901 $10 Bison,"Product ID: 42933,  Year: N/A,  Grade: None,  Grade Service: None,  Denomination: 1 oz,  Mint Mark: N/A,  Metal Content: 1 troy oz,  Purity: .999,  Diameter: N/A mm,  Outer Pack: 500,  "
" Product Details  As low as $1.99 per coin over spot These Silver Eagle coins are available at a lower premium and may be damaged, cleaned, spotted, etc, but are only available while they last! Each coin contains a full ounce of .999 fine U.S. Silver!  Coin Highlights:   Contains 1 oz of .999 fine Silver. Multiples of 20 are packaged in mint tubes. Multiples of 500 are packaged in “Monster Boxes.” All other coins will be in protective packaging. Obverse: Adolph A. Weinman’s design showing Lady Liberty draped in an American flag, walking gracefully as the sun rises over a ridge. Reverse: A heraldic eagle is shown below 13 small stars, representing the original colonies. Guaranteed by the U.S. Mint. Easily store your Silver Eagles by adding a mint tube to your order. As a U.S. Mint authorized purchaser, APMEX is able to provide this popular and practical investment coin at an attractive price. Add the Silver Eagle to your cart today.   Related Searches  What is a Cull Coin?     ","1 oz Silver American Eagle (Cull, Damaged, etc.)","Product ID: 6912,  Year: Random,  Grade: Cull,  Grade Service: None,  Denomination: $1.00,  Mint Mark: Random,  Metal Content: 1 troy oz,  Purity: .999,  Thickness: 2.98 mm,  Diameter: 40.6 mm,  Inner Pack: 20,  Outer Pack: 500,  "
" Product Details  As low as $0.79 per coin over spot These were the last years that the Canadian Silver dollar was made for circulation. Design varies by year but each is unique in its own right, adding beauty to the Silver content of the coins.  Coin Highlights:   Contains .600 oz of Silver. Quantities of 20 or more come in tubes. Single coins come in protective packaging. Obverse: A young portrait of Queen Elizabeth II. Reverse: Design varies. Coins come in mostly Almost Uncirculated to Brilliant Uncirculated conditions. These classic Silver dollars are an easy way of adding Silver to your collection. Add these Silver dollars to your cart today!  ",1958-1967 Canada Silver Dollar AU/BU (.800 Fine),"Product ID: 8564,  Year: Random,  Grade: AU/Unc,  Grade Service: None,  Denomination: $1.00,  Mint Mark: Not Shown,  Metal Content: 0.6 troy oz,  Purity: .800,  Thickness: 2.95 mm,  Diameter: 36 mm,  Outer Pack: 500,  "
" Product Details  As low as $0.99 per oz over spot Sunshine Minting has taken the beloved Silver Buffalo and created a product that combines this classic design with Sunshine's unique security feature, MintMark SI™, which helps authenticate the origin and .999 purity of your Silver round.  Round Highlights:   Contains 1 oz of .999 fine Silver. Multiples of 20 rounds are packaged in sealed tubes. Multiples of 500 are packaged in boxes. Single rounds come in protective packaging. The design of these rounds is based on the original coin issued by the U.S. Mint. These rounds carry no actual face value. Eligible for Precious Metals IRAs . Obverse: A rendition of James Earle Fraser’s acclaimed “Buffalo Nickel” design of an American Indian in profile. Reverse: Features an American buffalo, which is a visual representation of the bison named Black Diamond, along with the mintmark SI™ feature, weight and purity. Guaranteed by Sunshine Minting. Authenticate your new Sunshine Minting Silver rounds with the Sunshine Mint Decoder Lens ! When viewed through Sunshine Minting's special decoder lens at the same angle shown in the image above (with card held flush to your Silver round), the central design shows the word ""Valid,"" but when you turn the decoder lens ninety degrees, a sunburst appears. These two different views further verify your 1 oz Silver round. You can rest assured knowing you are getting the highest quality products possible produced by Sunshine Minting with the MintMark SI™ feature. Add 1 oz Sunshine Buffalo Silver Rounds to your cart today!   Related Searches  Buffalo Nickel     Silver rounds, like Silver Buffalo rounds, are created to be good investment bullion.  1 oz Silver rounds like Silver Buffalo rounds , are considered investment-grade bullion rounds that offer some of the best prices for Silver. These Silver rounds are sold at a low premium over spot price because you are not paying for any collector value. Buy Silver like these rounds when you want to boost your short-term investments and long-term investments for retirement. Keep track of Silver prices to ensure you receive the best price, and then buy in larger quantities to gain discounts for larger orders.    Store 1 oz Silver rounds at Citadel for peace of mind knowing your investment is safe.  Once you have 1 oz Silver rounds and other Silver bullion , it is time to consider storage options. Many store Silver rounds at home, but you may also want to consider safe storage at an outside facility. Many buy Silver and other Precious Metals and store the Silver bullion at the Citadel Global Depository Services maximum security facility, which is a wholly-owned subsidiary of APMEX. No matter the Silver prices, storage at Citadel is a low-price way to maintain peace of mind, knowing this facility is managed by Brink’s, one of the world’s leading security companies.    James Earle Fraser’s famous artwork on the 1913 Buffalo Nickel inspired the designs on the Silver Buffalo round.      ",1 oz Silver Round - Buffalo (MintMark SI),"Product ID: 85235,  Year: N/A,  Grade: None,  Grade Service: None,  Denomination: 1 oz,  Mint Mark: N/A,  Metal Content: 1 troy oz,  Purity: .999,  Thickness: 2.8 mm,  Diameter: 39 mm,  Inner Pack: 20,  Outer Pack: 500,  "
" Product Details  As low as $4.99 per coin over spot The Silver Eagle is the most popular bullion coin in the world. This stunning Silver bullion coin is valued for its 1 oz metal content, beautiful patriotic design and government guarantee.  Coin Highlights:   Contains 1 oz of .999 fine Silver. Multiples of 20 are packaged in mint tubes. Multiples of 500 are packaged in “Monster Boxes.” All other coins will be in protective packaging. Eligible for Precious Metals IRAs . Obverse: Adolph A. Weinman’s design showing Lady Liberty draped in an American flag, walking gracefully as the sun rises over a ridge. Reverse: A heraldic eagle is shown below 13 small stars, representing the original colonies. Sovereign coin backed by the U.S. government. Protect your 2017 American Silver Eagle with this clear plastic capsule  or display it in style by adding an attractive presentation box or jewelry bezel to your order. One of the most popular designs in American coinage, the Silver Eagle combines beauty with Silver bullion appeal. Add the 2017 1 oz Silver Eagle to your cart today! The U.S. Mint does not sell its bullion coins directly to the public. Instead, they distribute their coins to only a handful of authorized purchasers who then sell the coins to the public. As one of these authorized purchasers, APMEX is able to get coins direct from the U.S. Mint and pass them along to you.   Related Searches  2018 Silver Eagles American Silver Eagle Prices Silver Eagle Coins     Store your 2017 U.S. Silver Eagles at Citadel, where you can track holdings.  To protect your 2017 Silver Eagle coins or any other Precious Metals, use Citadel Global Depository Services, a wholly owned subsidiary of APMEX. Those 1 oz Silver Eagle coins take up a lot of space, but Citadel will keep them separate from other holdings while also protecting the bullion against theft, damage or loss. Silver coin prices can vary quickly, and Citadel offers tracking and management tools online as well as free delivery on demand when you are ready to sell. When you purchase U.S. Silver Eagles or any other valuable coins available at APMEX, Citadel will ship your holdings to its vaults at no cost.    Silver American Eagle coins are one of the most popular Silver coin programs by the United States Mint.      ",2017 1 oz Silver American Eagle BU,"Product ID: 102275,  Year: 2017,  Grade: Brilliant Unc,  Grade Service: None,  Denomination: $1.00,  Mint Mark: Not Shown - West Point,  Metal Content: 1 troy oz,  Purity: .999,  Thickness: 2.98 mm,  Diameter: 40.6 mm,  Inner Pack: 20,  Outer Pack: 500,  "
