product_details,product_name,specifications
" Product Details  As low as $1.99 per coin over spot Beautifully designed, this iconic coin from the Austrian Mint is available in .999 fine Silver making it an ideal investment piece.  Coin Highlights:   Contains 1 oz of .999 fine Silver. Tamper evident seals on mint tubes and monster boxes. Multiples of 20 are packaged in mint tubes. Multiples of 500 are packaged in red “Monster Boxes.” All other coins will be in protective packaging. Eligible for Precious Metals IRAs . Obverse: The Great Organ of the Golden Hall in Vienna’s concert hall, the Musikverein, along with the year, weight and face value. Reverse: An array of instruments, including the cello, violin, harp, Vienna horn and bassoon. Guaranteed by the Austrian Mint. Protect your Silver Philharmonic with this clear plastic capsule  or display it in style by adding an attractive presentation box to your order. This stunning Silver bullion coin is loved around the world for its 1 oz metal content and classic, recognizable design. Add the 2019 Silver Austrian Philharmonic coin to your cart today! Vienna Philharmonic coins are popular bullion coins made from Gold, Silver and Platinum. The Gold Philharmonic was first offered for purchase on October 10, 1989. The 1 oz Gold coin was made from .9999 fine Gold with a face value of 2,000 Austrian schillings. In 2002, the nominal face value changed to €100 with the adoption of the euro. Since its inception, the Gold Philharmonic has retained a depiction of the great pipe organ in the Vienna Musikverein’s Golden Hall on the obverse and an array of instruments, including the cello, violin, harp, Vienna horn and bassoon, on the reverse. Gold Philharmonic coins come in a variety of sizes, including 1/25 oz, 1/10 oz, 1/4 oz, 1/2 oz and 1 oz Gold coins. On February 1, 2008, a 1 oz Silver version of the coin was issued. The Silver Philharmonics feature the same designs found on the Gold Philharmonics and are made of .999 fine Silver. The Austrian Mint decided to further expand their Philharmonic line with a 1 oz Platinum coin in 2016. The Platinum Philharmonic kept the same design as the Gold and Silver Philharmonics and is made from .9995 fine Platinum. For the 15th anniversary of the Vienna Philharmonic Gold bullion coin in 2004, the Austrian Mint created a 1,000 oz version with a face value of €100,000. The ""Big Phil"" coin contains 31.103 kg of .9999 fine Gold. For the 20th anniversary, the Austrian Mint created a 20 oz .9999 fine Gold Philharmonic coin. On the 25th anniversary, the Austrian Mint introduced a new size in the series with the 1/25 oz .9999 fine Gold Philharmonic coin that is a permanent size for the series.    Philharmonic Silver Coins and Austria’s Love of Music The 1 oz Vienna Philharmonic is made in Austria from .999 fine Silver bullion. The Austrian Mint has struck the the series each year since 2008. Inspired by one of Vienna’s most famous cultural symbols, music, this series of coins has become one of the best-selling forms of bullion in Europe. While numerous ideas were suggested for the original design, it was overwhelmingly decided that classical music would be used. The Vienna Philharmonic Orchestra, founded in 1842, is regarded by many to be one of the best in the world. The 2019 Silver Vienna Philharmonic has a face value of 1.50 euros, although the value of the Precious Metal content is much higher. Musical instruments appear on both the obverse and the reverse, making this a particular favorite among collectors and investors who have a sincere appreciation for classical music and Austrian history. The Vienna Philharmonic Silver bullion coin is .999 fine and the quality is guaranteed.    The Birth of the Austria 1 oz Silver Philharmonic Coin The Austrian government passed legislation in 1998 that allowed bullion coins to be issued, which is when the Philharmonic coin was born. The Gold version proved to be so popular that a few years later, the Silver Vienna Philharmonic coin was created. The Austrian Mint recently introduced a Platinum version of the Philharmonic with the same exquisite design by Thomas Pesendorfer, their chief engraver. The obverse is struck with the famous pipe organ installed at the Wiener Musikverein concert hall, home to the Vienna Philharmonic. The words “Republik Österreich,” are featured above the instrument, with words indicating weight and Silver purity. While the pipe organ gets a solo on the obverse, an energetic group of instruments appear on the reverse. A cello takes center stage, surrounded by four violins, a winding Viennese horn and a beautiful harp. The bassoon represents the woodwind section.    The organ represented on the 2019 Silver Vienna Philharmonic was built in 1913 by the Gebrüder Rieger company of Jägerndorf, Silesia.      ",2019 Austria 1 oz Silver Philharmonic BU,"Product ID: 171338,  Year: 2019,  Grade: Brilliant Unc,  Grade Service: None,  Denomination: 1.5 Euro,  Mint Mark: Not Shown,  Metal Content: 1 troy oz,  Purity: .999,  Thickness: 3.2 mm,  Diameter: 37 mm,  Inner Pack: 20,  Outer Pack: 500,  "
" Product Details  As low as $1.99 per coin over spot This 1 oz Silver Kangaroo coin is struck in .9999 fine Silver from the Perth Mint and has proven to be a popular investment option worldwide since its release.  A microscopic letter engraved into a letter from the coin's AUSTRALIAN KANGAROO heading provides you authentication and detection against counterfeits. Coin Highlights:   Contains 1 oz of .9999 fine Silver. Coin comes in protective packaging. Orders of 25 come in tubes, and orders of 250 coins come packaged in Mini Monster Boxes, which fit in standard safety deposit boxes. Obverse: Bears the Jody Clark likeness of Her Majesty Queen Elizabeth II and the face value. Reverse: Features the classic red kangaroo design by Dr. Stuart Devlin, surrounded by a radiating design meant to symbolize sunlight, along with a micro-engraved letter appearing under magnification. Sovereign coin backed by the Australian government. Protect your 2019 Australian Silver Kangaroo with this clear plastic capsule  or display it in style by adding an attractive presentation box or jewelry bezel to your order. The 2019 Silver Kangaroo not only features a gorgeous design, and is offered at a terrific bullion price point. Add the 2019 1 oz Silver Kangaroo from the Perth Mint to your cart today! Mint-sealed tubes of 25-coins feature a holographic security strip placed on top of the tube by The Perth Mint, allowing the ability to tell if the tube has been tampered with since leaving the mint. The kangaroo is the most instantly recognizable wildlife symbol of Australia. The world's largest marsupial, females carry their infants around in their pouch for two months after being born. These young kangaroos, called joeys, will stay close to their mothers until about eight months of age. Red Kangaroos hop along on their powerful hind legs and do so at tremendous speed and with incredible grace. In fact, a red kangaroo can reach speeds of over 35 miles per hour! Their massive gait allows them to cover 25 feet in a single leap. The male kangaroos are larger than the females, and sometimes fight over potential mates by leaning back on their tails and boxing each other with their strong hind legs.    Making the Silver Australian Kangaroo Coin The 2019 Silver Australian Kangaroo 1 oz coin is a highly collectible investment piece produced by the world-renowned Perth Mint. The exquisite finish only enhances the extremely popular design and includes many security features that ensure authenticity. The Perth Mint is owned and operated by the government of West Australia and each coin is sovereign currency backed by the country. Knowing that the Kangaroo coins are made to some of the highest standards in the world add value for both collectors and investors. The Kangaroo Silver coin from The Perth Mint was initially introduced in 2016. Australia is regarded for all of the bullion coins it produces, although any series that features native wildlife from the continent is sought-after by collectors. Other favorite designs include the laughing kookaburra and another marsupial, the koala. Global fascination with lovable kangaroos, however, makes this Silver 1 oz coin a favorite for many.    The Artwork of Kangaroo Bullion Coins from Australia The obverse of this Silver bullion coin from Australia is struck with a likeness of Her Majesty the Queen of England, and features her name, “Elizabeth II.” The artist Ian Rank-Broadley created the portrait, which has been used on many other coin series, as well. The country of origin also appears, along with the face value of “1 Dollar.” Of course, the Silver used to make this beautiful coin is worth far more than the guaranteed legal tender amount. A proprietary method is used within the design to create a mirror and matte combination finish, which is very difficult to duplicate, adding a verifiable layer of security. The reverse of this coin features a design created exclusively for this series. The iconic Australian Kangaroo appears, framed by the weight of 1 oz, and a confirmation of the metal and fineness, “.9999 Silver.” A laser-engraved letter within the text, visible under magnification, offers another means of authentication and counterfeit detection.    The 2019 Silver Australian Kangaroo coin depicts the red kangaroo, the largest of all kangaroos.      ",2019 Australia 1 oz Silver Kangaroo BU,"Product ID: 171686,  Year: 2019,  Grade: Brilliant Unc,  Grade Service: None,  Denomination: $1.00,  Mint Mark: P - Perth Mint,  Metal Content: 1 troy oz,  Purity: .9999,  Thickness: 2.98 mm,  Diameter: 40.6 mm,  Outer Pack: 250,  "
" Product Details  As low as $1.39 per round over spot This stunning 1 oz Silver round features a beautiful design of the Aztec Calendar Sun Stone in spectacular detail.  Round Highlights:   Contains 1 oz of .999 fine Silver. Individual rounds come in protective packaging. Multiples of 20 come in plastic tubes and boxes contain multiples of 500. Obverse: Depicts the famous Aztec Calendar stone. The design is in a circular shape resembling a sun, with rays emanating outward. In the center is the face of the Aztec solar deity, Tonatiuh, which gives the monolith its alternate name the Sun Stone. Reverse: depicts the striking left portrait of Cuauhtemoc, the last Aztec Emperor of Tenochtitlan. The name Cuauhtemoc means ""Descending Eagle,"" as in the moment when an eagle folds its wings and plummets down to strike its prey. He wears the traditional headdress and ear ornaments of the Aztec elite, and is surrounded by an Aztec border as well as the inscriptions of his name and the metal content, weight, and purity. Made in the U.S.A. Protect and display your Silver round in style by adding an attractive presentation box recommended for this round. Add this 1 oz Silver Round to your cart today!  ",1 oz Silver Round - Aztec Calendar,"Product ID: 179489,  Year: N/A,  Grade: None,  Grade Service: None,  Metal Content: 1 troy oz,  Purity: .999,  Thickness: 4.6 mm,  Diameter: 39.04 mm,  Outer Pack: 500,  "
" Product Details  As low as $0.79 per round over spot This 1/10 oz Silver round takes its design from one of the most beloved coins in American history: the Walking Liberty Half Dollar. These fractional rounds are an affordable way to invest in quality Silver bullion (mintmark and designs may vary).  Round Highlights:   Contains 1/10 oz of .999 fine Silver. Individual rounds come in protective packaging. Multiples of 50 come in plastic tubes. The design of these rounds is based on the original coin issued by the U.S. Mint. These rounds carry no actual face value. Obverse: Adapted from Adolph A. Weinman’s classic 1916 design of Lady Liberty draped in an American flag, carrying branches of laurel and oak, symbolizing both civil and military glory. Reverse: Various designs. Dimensions may vary slightly. Protect your 1/10 oz Walking Liberty Silver round in style by adding a protective plastic capsule to your order. Fractional Silver is an easy way to add Silver to your investment portfolio at a lower cost. Add this APMEX 1/10 oz Silver Walking Liberty round to your cart today!  ",1/10 oz Silver Round - Walking Liberty,"Product ID: 60059,  Year: N/A,  Grade: None,  Grade Service: None,  Denomination: 1/10 oz,  Mint Mark: N/A,  Metal Content: 0.1 troy oz,  Purity: .999,  Thickness: 1.35 mm,  Diameter: 18 mm,  Inner Pack: 50,  "
" Product Details  As low as $0.79 per oz over spot These 10 oz APMEX Silver bars have a deep-mirror, prooflike finish and are guaranteed .999+ fine. The classic American eagle design adds an iconic beauty on top of the bullion content.  Bar Highlights:   Contains 10 oz of .999 fine Silver. Bars may or may not come sealed in plastic and dimensions may vary slightly. Obverse: Beautiful American eagle design common amongst APMEX products featuring 13 small stars representing the original colonies. This design is shown below the bar’s weight and purity. Reverse: APMEX logo and web address, weight and purity. Guaranteed by APMEX. Protect your Silver while in storage from the adverse effects of moisture in the air by adding these silica gel desiccants to your order. The 10 oz APMEX Silver Bar's attractive premium and larger metal content makes it a staple for any savvy investor's portfolio. Add this practical Silver investment to your cart today!   Related Searches  10 oz Silver Bars APMEX Silver Bars     Invest in 10 oz Silver bars for a Precious Metal that is valued for many industrial uses.  These 10 oz Silver bars from APMEX are an easy way to own a Precious Metal that has held its value throughout history. Silver bar investments are a good choice because the Silver value holds more easily than Precious Metals that are not as readily a part of everyday life, as Silver is used for so many things. Silver is used most in electrical products and electronic products, with Silver coins and medals a close second. Other common uses of Silver include photography, jewelry and Silverware. These various uses help maintain the Silver bars’ value, and makes buying 10 ounce Silver bars a no-brainer for a stable investment. These 10 oz Silver bars are also easy to store, so it is easy to keep your Silver investments securely in one place.    When buying 10 oz Silver bars, consider safe storage in a maximum-security facility.  Collecting 10 oz Silver bars is an excellent investment, so it is important to consider secure storage. Store your Silver bar investments in a home safe, or add these 10 oz Silver bars to your safe-deposit box. To secure your 10 ounce Silver bars, you can also take advantage of the Citadel Global Depository Services , a wholly-owned subsidiary of APMEX. Keep your 10 oz Silver bars and other Precious Metals at Citadel to take advantage of maximum-security storage, where valuables are managed by Brink’s, one of the world’s leading security companies.    10 ounce Silver bars by APMEX feature the patriotic artwork of an eagle and stars common to many APMEX products.      ",10 oz Silver Bar - APMEX,"Product ID: 27087,  Year: N/A,  Grade: None,  Grade Service: None,  Denomination: 10 oz,  Mint Mark: Varies,  Metal Content: 10 troy oz,  Purity: .999,  Thickness: 6.8 mm,  Outer Pack: 50,  "
" Product Details  As low as $19.99 per coin Featuring the iconic Silver Dollar design (1878-1921) by George T. Morgan, these Morgan Silver Dollars offer nostalgia along with value that benefits any numismatic collection.  Product Highlights:   Each coin contains .7734 oz of Pure Silver. Individual coins come in protective plastic bags. Multiples of 20 come in plastic tubes. Multiples of 100 come in 100-count bags. Multiples of 500 come in 500-count bags. Obverse: Left facing profile of Liberty wearing a Phrygian cap adorned with wheat and cotton balls in her hair. Reverse: Bald eagle with outstretched wings clutching an olive branch and arrows in its talons. 1921 (only) U.S. Mint issues from the following mints: * No Mintmark – Philadelphia * D – Denver * S – San Francisco Protect and display your Morgan Dollar Collection in style by adding an attractive album or holder to your order. These problem-free common date coins retain their original design elements and exhibit honest wear. Add this last year of the Morgan Silver Dollar to your cart today! These 1921 Morgan Dollars are of mixed mintmarks of P, D or S or may all be of the same mint determined by stock on hand. The Morgan Dollar holds a special place in U.S. coinage as it was the first coin to feature Lady Liberty with an American look, rather than the traditional Greek style. Her cap is adorned with wheat and cotton as a tribute to America's agricultural history. The image of the eagle was also updated for the Morgan Dollar, showing a proportionally correct eagle with beautifully designed feathers. He carries an olive branch, showing America's desire for peace, and is perched atop a bundle of arrows, signifying America's readiness to defend her borders against attack. The Morgan Dollar flooded the markets from 1878-1904. Nearly two decades after production halted, the Morgan Dollar was seen again for one year only, in 1921, due to a renewed desire for this iconic, beautiful design.   Related Searches  What is 90% Silver?     Collect 1921 Morgan Dollars that bear the name of their designer, George T. Morgan. 1921 Morgan Dollars feature the iconic Lady Liberty design that George T. Morgan designed for the launch of these beautiful Silver coins in 1878. Before designing Silver coins for the U.S. Mint, Morgan was a well-respected assistant engraver at the British Royal Mint, and it was this respect that earned him the recommendation from the British Royal Mint’s Director, Charles W. Fremantle, for the U.S. Mint job. Though the Silver bullion Morgan is best known for designing is the Morgan Silver Dollar, he also designed many other popular coins such as the Bland Dollar.    Scandal and intrigue surrounds 1921 Morgan Dollars. Before designing 1921 Morgan Dollars , engraver George T. Morgan needed to find a female model to help him create the Lady Liberty portrait he envisioned. Modeling for a Silver coin design, or any art for that matter, was considered scandalous and not something a proper woman would do. Eventually schoolteacher Anna Willess Williams agreed to model for the Silver bullion design under the strict provision that her identity remain anonymous because she could lose her job. Williams’ involvement with the Silver coins remained hidden for a while, though she did eventually lose her job when a newspaper reporter uncovered her secret years later.    The 1921 Morgan Dollar was released due to renewed desire for the Morgan Dollar design that had been discontinued in 1904.      ","1921 P, D, or S Mint Morgan Silver Dollars VG-XF (Random)","Product ID: 160,  Year: 1921,  Grade: Other,  Grade Service: None,  Denomination: $1.00,  Mint Mark: Varies,  Metal Content: 0.7734 troy oz,  Purity: .900,  Thickness: 3.1 mm,  Diameter: 38.1 mm,  "
" Product Details  As low as $0.89 per round over spot This fractional Silver round depicts the same proud Liberty used on the Standing Liberty Quarter from 1916-1930, and features a reeded edge. These rounds allow for an easy way to own a classic American design in .999 fine Silver.  Round Highlights:   Contains 1/4 oz of .999 fine Silver. Individual rounds come in protective plastic flips. Multiples of 20 may come in a plastic tube. The design of these rounds is based on the original coin issued by the U.S. Mint. These rounds carry no actual face value. Obverse: Adapted from Hermon A. MacNeil's depiction of Lady Liberty holding a shield and an olive branch, desiring peace but ready to defend her country. Reverse: An eagle flying from left to right with ""American Precious Metals Exchange"" above and the round's weight below. Guaranteed by APMEX. Protect your rounds from fingerprints by adding these cotton gloves to your order. The design on this 1/4 oz Silver round is a great way to add fractional Silver to your investment portfolio with a touch of beauty. Add this APMEX 1/4 oz Silver (Standing Liberty Quarter) round to your cart today!    The price of fractional Silver rounds depends on the refining process and final product.  When buying 1/4 oz Silver round bullion , it is important to know what you are paying for. The price for Standing Liberty quarter rounds starts with the spot price of Silver, which no one pays because it is the price of unfabricated Silver. You will pay the premium price of Silver rounds , which includes the cost of fabrication, distribution, a nominal dealer fee and any numismatic or collector value. Because prices for fractional Silver rounds and other Precious Metals are always based on these factors, you can buy Silver for the same price per troy ounce anywhere in the world.    The value of Silver rounds is bolstered by the many uses of Silver.  When buying 1/4 oz Silver rounds and other Silver bullion , you can watch for news about how Silver is used to keep an eye on demand in the market. If you melt down a Standing Liberty quarter round, for example, it has many uses in the medical world because of the strong antibacterial properties of Silver. The Silver in fractional Silver rounds can make dozens of connections in electronics, where Silver is prized for being the most conductive metal. Your Silver rounds stay shiny because Silver resists corrosion and oxidation, another property useful in industrial applications as well as for making Silver jewelry.    These fractional Silver rounds are an excellent way to own iconic American coin designs, featuring the 1916 Standing Liberty design, crafted in .999 fine Silver available at a low price point.      ",1/4 oz Silver Round - APMEX (Standing Liberty Quarter),"Product ID: 60934,  Year: N/A,  Grade: None,  Grade Service: None,  Denomination: 1/4 oz,  Mint Mark: N/A,  Metal Content: 0.25 troy oz,  Purity: .999,  Thickness: 1.79 mm,  Diameter: 26.57 mm,  Inner Pack: 20,  Outer Pack: 980,  "
" Product Details  As low as $7.99 per bar over spot Secondary market Gold bars are a popular way to invest in Gold bullion, often at low premiums. Although the Gold bars you receive could be perfect, nice, scruffy or somewhere in between, each of these bars is tested for Gold content and purity.  Bar Highlights:   Contains 1 gram (0.03215 oz) of .9999 fine Gold. Individual bars are presented in protective packaging. Obverse: Varies depending upon the bar that you receive. Reverse: Varies by bar. APMEX stands behind every 1 gram Gold bar in our vast inventory. Protect your investments from fingerprints by adding these cotton gloves to your order. Gram Gold bars offer high quality Gold at a lower price point than their full ounce counterparts. Add these secondary market 1 gram Gold bars to your portfolio today! The Gold bars you receive will be of our choosing limited to stock on hand.   Related Searches   What are Secondary Market Metals? How to Recycle Gold     How is the price of 1 gram Gold bars determined?  Gold, including 1 gram Gold bars , has been regarded as extremely valuable for thousands of years. Today, the price of Gold per ounce is affected by many different factors, including production, use by central bank reserves, the value of the U.S. dollar, global demand and the economic climate. As you browse Gold bars, check the live spot prices of Gold and you will notice that the Gold price changes every few seconds. Though the price of Gold bars may fluctuate, many view Gold as a way to balance investment portfolios because the value of Gold tends to be stable or rise when economies experience downturns.    When buying 1 gram Gold bars, timing is everything.  Savvy investors buy 1 gram Gold bars when the Gold spot price dips. As you consider Gold bullion purchases, sign up for APMEX’s Market Alerts , and receive a ping when the price of Gold hits your desired price. For alerts on specific Gold bars, sign up for Price Alerts and APMEX will contact you when the product is available at the price you want. With these services, buying Gold bullion is made easier.    Gram Gold bars are an excellent way to invest in Gold at a low price point.      ",1 gram Gold Bar - Secondary Market,"Product ID: 12477,  Year: N/A,  Grade: None,  Grade Service: None,  Denomination: 1 gram,  Mint Mark: N/A,  Metal Content: 0.0322 troy oz,  Purity: .9999,  Thickness: Varies mm,  Diameter: N/A mm,  Inner Pack: 100,  "
" Product Details The 1 oz Silver Buffalo Round pays tribute to America’s native tribes and the majestic, once endangered buffalo. James Earle Fraser’s design for the 1913 Buffalo Nickel has inspired both images featured on this round. Mintmark and designs may vary.  Round Highlights:   Contains 1 oz of .999 fine Silver. Individual rounds come in protective packaging. Multiples of 20 come in plastic tubes and boxes contain multiples of 500. The design of these rounds is based on the original coin issued by the U.S. Mint. These rounds carry no actual face value. Obverse: Depicts a Native American with the motto ”LIBERTY” on top right. Reverse: ""Black Diamond,"" an American bison (buffalo) atop a mound of dirt. Fraser sketched this design in the New York Central Park Zoo. Guaranteed by APMEX. Protect and display your Silver round in style by adding an attractive presentation box recommended for this round. James Earle Fraser's Indian Head nickel design is regarded among the best designs of any U.S. coin. Add this sought after Silver Buffalo Round to your cart today!  ",1 oz Silver Round - Buffalo,"Product ID: 97880,  Grade: None,  Grade Service: None,  Denomination: 1 oz,  Mint Mark: N/A,  Metal Content: 1 troy oz,  Purity: .999,  Thickness: 2.5 mm,  Diameter: 39.04 mm,  Inner Pack: 20,  Outer Pack: 500,  "
